{"automation_status":"passed_auto_checks","background_only":true,"can_enter_canonical_evidence":false,"coverage_limits":{"reason":"The bounded synthetic source contains one section.","unread_sections":[],"weakly_read_sections":[]},"created_at":"2026-01-01T00:00:03Z","fixture_origin":"synthetic_from_scratch","memory_value":{"reason":"Synthetic units are retained.","status":"reusable"},"non_reusable_notes":[],"not_fact":true,"one_sentence_reuse_value":"Provides fabricated background units for catalog testing.","paper_id":"paper_c5743fa9-6803-4e6a-9928-46b07399d761","parse_snapshot":{"adapter":"synthetic-text","parse_run_id":"event_9f8a3309-0963-4d9d-9a91-b0c093013b53","version":"1.0"},"read_status":"targeted_read","review_memory_id":"reviewmem_16b1020a-95d8-429c-95cc-b7f7a359f37a","review_status":"ai_checked","review_subtype":"narrative_review","review_subtype_reason":"The synthetic source is declared as a review fixture.","review_subtype_source":"agent_high_confidence","schema_version":"1.0","scope_tags":["synthetic_catalog"],"sections":[{"section_id":"review_objective_scope","units":[]},{"section_id":"review_question_search_boundaries","units":[]},{"section_id":"taxonomy_field_structure","units":[{"background_only":true,"can_enter_canonical_evidence":false,"content":"Synthetic Review Unit 1 for item 00000004.","evidence_use":{"can_guide_primary_grounding":true,"can_support_canonical_evidence":false,"primary_grounding_required_before":["comparative_claim"]},"not_fact":true,"primary_paper_lead":null,"reuse_quality":{"reason":"The fabricated unit is explicit in the synthetic source.","reuse_confidence":"medium","staleness_risk":"low"},"review_unit_id":"reviewunit_f563d636-fd19-4a9f-938b-57cd3729f823","section_id":"taxonomy_field_structure","source_notes":[{"figure_or_table":null,"locator":null,"note_type":"paraphrase","pdf_page":1,"printed_page":null,"reopen_priority":"high","section":"Synthetic taxonomy","text":"The fabricated review groups response timing for synthetic item 00000004."}],"unit_type":"field_axis","workflow_impacts":[{"action":"Use this fabricated category only for synthetic routing tests.","target":"primary_paper_reading"}]},{"background_only":true,"can_enter_canonical_evidence":false,"content":"Synthetic Review Unit 2 for item 00000004.","evidence_use":{"can_guide_primary_grounding":true,"can_support_canonical_evidence":false,"primary_grounding_required_before":["comparative_claim"]},"not_fact":true,"primary_paper_lead":null,"reuse_quality":{"reason":"The fabricated unit is explicit in the synthetic source.","reuse_confidence":"medium","staleness_risk":"low"},"review_unit_id":"reviewunit_3b6b8631-b8ce-4c6b-915d-e74bbb5c7b59","section_id":"taxonomy_field_structure","source_notes":[{"figure_or_table":null,"locator":null,"note_type":"paraphrase","pdf_page":1,"printed_page":null,"reopen_priority":"high","section":"Synthetic taxonomy","text":"The fabricated review groups response timing for synthetic item 00000004."}],"unit_type":"method_guardrail","workflow_impacts":[{"action":"Use this fabricated category only for synthetic routing tests.","target":"primary_paper_reading"}]},{"background_only":true,"can_enter_canonical_evidence":false,"content":"Synthetic Review Unit 3 for item 00000004.","evidence_use":{"can_guide_primary_grounding":true,"can_support_canonical_evidence":false,"primary_grounding_required_before":["comparative_claim"]},"not_fact":true,"primary_paper_lead":null,"reuse_quality":{"reason":"The fabricated unit is explicit in the synthetic source.","reuse_confidence":"medium","staleness_risk":"low"},"review_unit_id":"reviewunit_97451756-da87-4d45-b203-47cf91c771e9","section_id":"taxonomy_field_structure","source_notes":[{"figure_or_table":null,"locator":null,"note_type":"paraphrase","pdf_page":1,"printed_page":null,"reopen_priority":"high","section":"Synthetic taxonomy","text":"The fabricated review groups response timing for synthetic item 00000004."}],"unit_type":"frontier_topic","workflow_impacts":[{"action":"Use this fabricated category only for synthetic routing tests.","target":"primary_paper_reading"}]}]},{"section_id":"major_synthesis","units":[]},{"section_id":"methods_metrics_guardrails","units":[]},{"section_id":"gaps_frontiers","units":[]},{"section_id":"primary_leads_reuse","units":[]}],"source_fingerprint":{"algorithm":"sha256","value":"45a31683d31cc897156844294c3acc0a3993c68765479d0ae6bca29bfa3291f3"},"source_type":"review","updated_at":"2026-01-01T00:00:03Z"}
